[
  {
    "name": "Belfast -> Alicante 16.99£",
    "url": "https://www.ryanair.com/de/de/trip/flights/select?adults=1&dateOut=2026-01-06&originIata=BFS&destinationIata=ALC",
    "date": "06.01.2026"
  },
  {
    "name": "Birmingham -> Barcelona 16.99£",
    "url": "https://www.ryanair.com/de/de/trip/flights/select?adults=1&dateOut=2026-01-07&originIata=BHX&destinationIata=BCN",
    "date": "07.01.2026"
  },
  {
    "name": "Christchurch -> Málaga 19.99£",
    "url": "https://www.ryanair.com/de/de/trip/flights/select?adults=1&dateOut=2026-01-07&originIata=BOH&destinationIata=AGP",
    "date": "07.01.2026"
  },
  {
    "name": "Hamburg -> Palma de Mallorca 17.99€",
    "url": "https://www.ryanair.com/de/de/trip/flights/select?adults=1&dateOut=2026-01-08&originIata=HAM&destinationIata=PMI",
    "date": "08.01.2026"
  },
  {
    "name": "Liverpool -> Málaga 16.99£",
    "url": "https://www.ryanair.com/de/de/trip/flights/select?adults=1&dateOut=2026-01-08&originIata=LPL&destinationIata=AGP",
    "date": "08.01.2026"
  },
  {
    "name": "Exeter -> Málaga 16.99£",
    "url": "https://www.ryanair.com/de/de/trip/flights/select?adults=1&dateOut=2026-01-09&originIata=EXT&destinationIata=AGP",
    "date": "09.01.2026"
  },
  {
    "name": "London -> Agadir (Temsia) 16.99£",
    "url": "https://www.ryanair.com/de/de/trip/flights/select?adults=1&dateOut=2026-01-09&originIata=STN&destinationIata=AGA",
    "date": "09.01.2026"
  },
  {
    "name": "Berlin -> Valencia 16.99€",
    "url": "https://www.ryanair.com/de/de/trip/flights/select?adults=1&dateOut=2026-01-10&originIata=BER&destinationIata=VLC",
    "date": "10.01.2026"
  },
  {
    "name": "Nürnberg -> Bari 17.99€",
    "url": "https://www.ryanair.com/de/de/trip/flights/select?adults=1&dateOut=2026-01-10&originIata=NUE&destinationIata=BRI",
    "date": "10.01.2026"
  },
  {
    "name": "Köln -> Rome 16.99€",
    "url": "https://www.ryanair.com/de/de/trip/flights/select?adults=1&dateOut=2026-01-10&originIata=CGN&destinationIata=FCO",
    "date": "10.01.2026"
  },
  {
    "name": "London -> Valencia 16.99£",
    "url": "https://www.ryanair.com/de/de/trip/flights/select?adults=1&dateOut=2026-01-10&originIata=STN&destinationIata=VLC",
    "date": "10.01.2026"
  },
  {
    "name": "Bristol -> Alicante 17.99£",
    "url": "https://www.ryanair.com/de/de/trip/flights/select?adults=1&dateOut=2026-01-10&originIata=BRS&destinationIata=ALC",
    "date": "10.01.2026"
  },
  {
    "name": "London -> Napoli 14.99£",
    "url": "https://www.ryanair.com/de/de/trip/flights/select?adults=1&dateOut=2026-01-10&originIata=STN&destinationIata=NAP",
    "date": "10.01.2026"
  },
  {
    "name": "Luton -> Barcelona 16.99£",
    "url": "https://www.ryanair.com/de/de/trip/flights/select?adults=1&dateOut=2026-01-10&originIata=LTN&destinationIata=BCN",
    "date": "10.01.2026"
  },
  {
    "name": "Birmingham -> Málaga 14.99£",
    "url": "https://www.ryanair.com/de/de/trip/flights/select?adults=1&dateOut=2026-01-10&originIata=BHX&destinationIata=AGP",
    "date": "10.01.2026"
  },
  {
    "name": "London -> Palma de Mallorca 16.99£",
    "url": "https://www.ryanair.com/de/de/trip/flights/select?adults=1&dateOut=2026-01-10&originIata=STN&destinationIata=PMI",
    "date": "10.01.2026"
  },
  {
    "name": "Rhoose -> Alicante 19.99£",
    "url": "https://www.ryanair.com/de/de/trip/flights/select?adults=1&dateOut=2026-01-11&originIata=CWL&destinationIata=ALC",
    "date": "11.01.2026"
  },
  {
    "name": "Paisley -> Alicante 17.99£",
    "url": "https://www.ryanair.com/de/de/trip/flights/select?adults=1&dateOut=2026-01-11&originIata=GLA&destinationIata=ALC",
    "date": "11.01.2026"
  },
  {
    "name": "London -> Lisbon 16.99£",
    "url": "https://www.ryanair.com/de/de/trip/flights/select?adults=1&dateOut=2026-01-11&originIata=STN&destinationIata=LIS",
    "date": "11.01.2026"
  },
  {
    "name": "Bristol -> Barcelona 14.99£",
    "url": "https://www.ryanair.com/de/de/trip/flights/select?adults=1&dateOut=2026-01-11&originIata=BRS&destinationIata=BCN",
    "date": "11.01.2026"
  },
  {
    "name": "Christchurch -> Alicante 14.99£",
    "url": "https://www.ryanair.com/de/de/trip/flights/select?adults=1&dateOut=2026-01-11&originIata=BOH&destinationIata=ALC",
    "date": "11.01.2026"
  },
  {
    "name": "Birmingham -> Corvera 17.99£",
    "url": "https://www.ryanair.com/de/de/trip/flights/select?adults=1&dateOut=2026-01-11&originIata=BHX&destinationIata=RMU",
    "date": "11.01.2026"
  },
  {
    "name": "Luton -> Málaga 15.99£",
    "url": "https://www.ryanair.com/de/de/trip/flights/select?adults=1&dateOut=2026-01-11&originIata=LTN&destinationIata=AGP",
    "date": "11.01.2026"
  },
  {
    "name": "Paderborn -> Alicante 17.99€",
    "url": "https://www.ryanair.com/de/de/trip/flights/select?adults=1&dateOut=2026-01-12&originIata=PAD&destinationIata=ALC",
    "date": "12.01.2026"
  },
  {
    "name": "Manchester -> Lisbon 16.99£",
    "url": "https://www.ryanair.com/de/de/trip/flights/select?adults=1&dateOut=2026-01-12&originIata=MAN&destinationIata=LIS",
    "date": "12.01.2026"
  },
  {
    "name": "Nottingham -> Málaga 14.99£",
    "url": "https://www.ryanair.com/de/de/trip/flights/select?adults=1&dateOut=2026-01-12&originIata=EMA&destinationIata=AGP",
    "date": "12.01.2026"
  },
  {
    "name": "Birmingham -> Palma de Mallorca 15.99£",
    "url": "https://www.ryanair.com/de/de/trip/flights/select?adults=1&dateOut=2026-01-12&originIata=BHX&destinationIata=PMI",
    "date": "12.01.2026"
  },
  {
    "name": "Birmingham -> Barcelona 14.99£",
    "url": "https://www.ryanair.com/de/de/trip/flights/select?adults=1&dateOut=2026-01-13&originIata=BHX&destinationIata=BCN",
    "date": "13.01.2026"
  },
  {
    "name": "Manchester -> Lisbon 17.99£",
    "url": "https://www.ryanair.com/de/de/trip/flights/select?adults=1&dateOut=2026-01-13&originIata=MAN&destinationIata=LIS",
    "date": "13.01.2026"
  },
  {
    "name": "London -> Gizzeria Lido 15.99£",
    "url": "https://www.ryanair.com/de/de/trip/flights/select?adults=1&dateOut=2026-01-14&originIata=STN&destinationIata=SUF",
    "date": "14.01.2026"
  },
  {
    "name": "London -> Bari 16.99£",
    "url": "https://www.ryanair.com/de/de/trip/flights/select?adults=1&dateOut=2026-01-14&originIata=STN&destinationIata=BRI",
    "date": "14.01.2026"
  },
  {
    "name": "Edinburgh -> Valencia 18.99£",
    "url": "https://www.ryanair.com/de/de/trip/flights/select?adults=1&dateOut=2026-01-14&originIata=EDI&destinationIata=VLC",
    "date": "14.01.2026"
  },
  {
    "name": "London -> Trapani (TP) 14.99£",
    "url": "https://www.ryanair.com/de/de/trip/flights/select?adults=1&dateOut=2026-01-15&originIata=STN&destinationIata=TPS",
    "date": "15.01.2026"
  },
  {
    "name": "Nottingham -> Faro 16.99£",
    "url": "https://www.ryanair.com/de/de/trip/flights/select?adults=1&dateOut=2026-01-16&originIata=EMA&destinationIata=FAO",
    "date": "16.01.2026"
  },
  {
    "name": "Manchester -> Lisbon 15.99£",
    "url": "https://www.ryanair.com/de/de/trip/flights/select?adults=1&dateOut=2026-01-17&originIata=MAN&destinationIata=LIS",
    "date": "17.01.2026"
  },
  {
    "name": "Newquay -> Alicante 15.99£",
    "url": "https://www.ryanair.com/de/de/trip/flights/select?adults=1&dateOut=2026-01-17&originIata=NQY&destinationIata=ALC",
    "date": "17.01.2026"
  },
  {
    "name": "Edinburgh -> Faro 18.99£",
    "url": "https://www.ryanair.com/de/de/trip/flights/select?adults=1&dateOut=2026-01-17&originIata=EDI&destinationIata=FAO",
    "date": "17.01.2026"
  },
  {
    "name": "Newcastle upon Tyne -> Málaga 18.99£",
    "url": "https://www.ryanair.com/de/de/trip/flights/select?adults=1&dateOut=2026-01-18&originIata=NCL&destinationIata=AGP",
    "date": "18.01.2026"
  },
  {
    "name": "Manchester -> Alicante 16.99£",
    "url": "https://www.ryanair.com/de/de/trip/flights/select?adults=1&dateOut=2026-01-18&originIata=MAN&destinationIata=ALC",
    "date": "18.01.2026"
  },
  {
    "name": "Belfast -> Alicante 16.99£",
    "url": "https://www.ryanair.com/de/de/trip/flights/select?adults=1&dateOut=2026-01-18&originIata=BFS&destinationIata=ALC",
    "date": "18.01.2026"
  },
  {
    "name": "Christchurch -> Alicante 16.99£",
    "url": "https://www.ryanair.com/de/de/trip/flights/select?adults=1&dateOut=2026-01-18&originIata=BOH&destinationIata=ALC",
    "date": "18.01.2026"
  },
  {
    "name": "Bristol -> Málaga 17.99£",
    "url": "https://www.ryanair.com/de/de/trip/flights/select?adults=1&dateOut=2026-01-18&originIata=BRS&destinationIata=AGP",
    "date": "18.01.2026"
  },
  {
    "name": "Luton -> Barcelona 14.99£",
    "url": "https://www.ryanair.com/de/de/trip/flights/select?adults=1&dateOut=2026-01-19&originIata=LTN&destinationIata=BCN",
    "date": "19.01.2026"
  },
  {
    "name": "Weeze -> Isola di Capo Rizzuto (KR) 16.99€",
    "url": "https://www.ryanair.com/de/de/trip/flights/select?adults=1&dateOut=2026-01-19&originIata=NRN&destinationIata=CRV",
    "date": "19.01.2026"
  },
  {
    "name": "Birmingham -> Valencia 16.99£",
    "url": "https://www.ryanair.com/de/de/trip/flights/select?adults=1&dateOut=2026-01-19&originIata=BHX&destinationIata=VLC",
    "date": "19.01.2026"
  },
  {
    "name": "Birmingham -> Gran Canaria Island 14.99£",
    "url": "https://www.ryanair.com/de/de/trip/flights/select?adults=1&dateOut=2026-01-19&originIata=BHX&destinationIata=LPA",
    "date": "19.01.2026"
  },
  {
    "name": "Newcastle upon Tyne -> Gran Canaria Island 14.99£",
    "url": "https://www.ryanair.com/de/de/trip/flights/select?adults=1&dateOut=2026-01-19&originIata=NCL&destinationIata=LPA",
    "date": "19.01.2026"
  },
  {
    "name": "Manchester -> Faro 14.99£",
    "url": "https://www.ryanair.com/de/de/trip/flights/select?adults=1&dateOut=2026-01-19&originIata=MAN&destinationIata=FAO",
    "date": "19.01.2026"
  },
  {
    "name": "Manchester -> Alicante 14.99£",
    "url": "https://www.ryanair.com/de/de/trip/flights/select?adults=1&dateOut=2026-01-20&originIata=MAN&destinationIata=ALC",
    "date": "20.01.2026"
  },
  {
    "name": "Edinburgh -> Valencia 17.99£",
    "url": "https://www.ryanair.com/de/de/trip/flights/select?adults=1&dateOut=2026-01-21&originIata=EDI&destinationIata=VLC",
    "date": "21.01.2026"
  },
  {
    "name": "London -> Gizzeria Lido 14.99£",
    "url": "https://www.ryanair.com/de/de/trip/flights/select?adults=1&dateOut=2026-01-21&originIata=STN&destinationIata=SUF",
    "date": "21.01.2026"
  },
  {
    "name": "Manchester -> Gran Canaria Island 14.99£",
    "url": "https://www.ryanair.com/de/de/trip/flights/select?adults=1&dateOut=2026-01-21&originIata=MAN&destinationIata=LPA",
    "date": "21.01.2026"
  },
  {
    "name": "Rhoose -> Alicante 19.99£",
    "url": "https://www.ryanair.com/de/de/trip/flights/select?adults=1&dateOut=2026-01-23&originIata=CWL&destinationIata=ALC",
    "date": "23.01.2026"
  },
  {
    "name": "Bristol -> Faro 16.99£",
    "url": "https://www.ryanair.com/de/de/trip/flights/select?adults=1&dateOut=2026-01-23&originIata=BRS&destinationIata=FAO",
    "date": "23.01.2026"
  },
  {
    "name": "London -> Barcelona 14.99£",
    "url": "https://www.ryanair.com/de/de/trip/flights/select?adults=1&dateOut=2026-01-25&originIata=STN&destinationIata=BCN",
    "date": "25.01.2026"
  },
  {
    "name": "London -> Tangier 17.99£",
    "url": "https://www.ryanair.com/de/de/trip/flights/select?adults=1&dateOut=2026-01-25&originIata=STN&destinationIata=TNG",
    "date": "25.01.2026"
  },
  {
    "name": "Karlsruhe -> Bari 16.99€",
    "url": "https://www.ryanair.com/de/de/trip/flights/select?adults=1&dateOut=2026-01-26&originIata=FKB&destinationIata=BRI",
    "date": "26.01.2026"
  },
  {
    "name": "London -> Palma de Mallorca 16.99£",
    "url": "https://www.ryanair.com/de/de/trip/flights/select?adults=1&dateOut=2026-01-26&originIata=STN&destinationIata=PMI",
    "date": "26.01.2026"
  },
  {
    "name": "Liverpool -> Málaga 17.99£",
    "url": "https://www.ryanair.com/de/de/trip/flights/select?adults=1&dateOut=2026-01-26&originIata=LPL&destinationIata=AGP",
    "date": "26.01.2026"
  },
  {
    "name": "London -> Valencia 14.99£",
    "url": "https://www.ryanair.com/de/de/trip/flights/select?adults=1&dateOut=2026-01-26&originIata=STN&destinationIata=VLC",
    "date": "26.01.2026"
  },
  {
    "name": "Paisley -> Alicante 14.99£",
    "url": "https://www.ryanair.com/de/de/trip/flights/select?adults=1&dateOut=2026-01-27&originIata=GLA&destinationIata=ALC",
    "date": "27.01.2026"
  },
  {
    "name": "Birmingham -> Paphos 18.99£",
    "url": "https://www.ryanair.com/de/de/trip/flights/select?adults=1&dateOut=2026-01-29&originIata=BHX&destinationIata=PFO",
    "date": "29.01.2026"
  },
  {
    "name": "Bristol -> Alicante 16.99£",
    "url": "https://www.ryanair.com/de/de/trip/flights/select?adults=1&dateOut=2026-02-01&originIata=BRS&destinationIata=ALC",
    "date": "01.02.2026"
  },
  {
    "name": "Christchurch -> Faro 16.99£",
    "url": "https://www.ryanair.com/de/de/trip/flights/select?adults=1&dateOut=2026-02-01&originIata=BOH&destinationIata=FAO",
    "date": "01.02.2026"
  },
  {
    "name": "Liverpool -> Málaga 16.99£",
    "url": "https://www.ryanair.com/de/de/trip/flights/select?adults=1&dateOut=2026-02-02&originIata=LPL&destinationIata=AGP",
    "date": "02.02.2026"
  },
  {
    "name": "London -> Bari 18.99£",
    "url": "https://www.ryanair.com/de/de/trip/flights/select?adults=1&dateOut=2026-02-02&originIata=STN&destinationIata=BRI",
    "date": "02.02.2026"
  },
  {
    "name": "London -> Palermo 16.99£",
    "url": "https://www.ryanair.com/de/de/trip/flights/select?adults=1&dateOut=2026-02-03&originIata=STN&destinationIata=PMO",
    "date": "03.02.2026"
  },
  {
    "name": "Bristol -> Alicante 17.99£",
    "url": "https://www.ryanair.com/de/de/trip/flights/select?adults=1&dateOut=2026-02-03&originIata=BRS&destinationIata=ALC",
    "date": "03.02.2026"
  }
]