[
  {
    "name": "Frankfurt am Main -> Palma de Mallorca 17.99€",
    "url": "https://www.ryanair.com/de/de/trip/flights/select?adults=1&dateOut=2026-01-25&originIata=HHN&destinationIata=PMI",
    "date": "25.01.2026"
  },
  {
    "name": "Frankfurt am Main -> Al Aaroui 16.99€",
    "url": "https://www.ryanair.com/de/de/trip/flights/select?adults=1&dateOut=2026-01-25&originIata=HHN&destinationIata=NDR",
    "date": "25.01.2026"
  },
  {
    "name": "Berlin -> Bari 21.99€",
    "url": "https://www.ryanair.com/de/de/trip/flights/select?adults=1&dateOut=2026-01-25&originIata=BER&destinationIata=BRI",
    "date": "25.01.2026"
  },
  {
    "name": "Frankfurt am Main -> Catania 15.99€",
    "url": "https://www.ryanair.com/de/de/trip/flights/select?adults=1&dateOut=2026-01-25&originIata=HHN&destinationIata=CTA",
    "date": "25.01.2026"
  },
  {
    "name": "Berlin -> Reggio Calabria 16.99€",
    "url": "https://www.ryanair.com/de/de/trip/flights/select?adults=1&dateOut=2026-01-25&originIata=BER&destinationIata=REG",
    "date": "25.01.2026"
  },
  {
    "name": "Karlsruhe -> Bari 14.99€",
    "url": "https://www.ryanair.com/de/de/trip/flights/select?adults=1&dateOut=2026-01-26&originIata=FKB&destinationIata=BRI",
    "date": "26.01.2026"
  },
  {
    "name": "Nürnberg -> Bari 14.99€",
    "url": "https://www.ryanair.com/de/de/trip/flights/select?adults=1&dateOut=2026-01-26&originIata=NUE&destinationIata=BRI",
    "date": "26.01.2026"
  },
  {
    "name": "Weeze -> Isola di Capo Rizzuto (KR) 14.99€",
    "url": "https://www.ryanair.com/de/de/trip/flights/select?adults=1&dateOut=2026-01-26&originIata=NRN&destinationIata=CRV",
    "date": "26.01.2026"
  },
  {
    "name": "Frankfurt am Main -> Gizzeria Lido 15.99€",
    "url": "https://www.ryanair.com/de/de/trip/flights/select?adults=1&dateOut=2026-01-26&originIata=HHN&destinationIata=SUF",
    "date": "26.01.2026"
  },
  {
    "name": "Karlsruhe -> Palma de Mallorca 16.99€",
    "url": "https://www.ryanair.com/de/de/trip/flights/select?adults=1&dateOut=2026-01-26&originIata=FKB&destinationIata=PMI",
    "date": "26.01.2026"
  },
  {
    "name": "Paderborn -> Alicante 14.99€",
    "url": "https://www.ryanair.com/de/de/trip/flights/select?adults=1&dateOut=2026-01-26&originIata=PAD&destinationIata=ALC",
    "date": "26.01.2026"
  },
  {
    "name": "Weeze -> Palma de Mallorca 14.99€",
    "url": "https://www.ryanair.com/de/de/trip/flights/select?adults=1&dateOut=2026-01-26&originIata=NRN&destinationIata=PMI",
    "date": "26.01.2026"
  },
  {
    "name": "Karlsruhe -> Málaga 14.99€",
    "url": "https://www.ryanair.com/de/de/trip/flights/select?adults=1&dateOut=2026-01-26&originIata=FKB&destinationIata=AGP",
    "date": "26.01.2026"
  },
  {
    "name": "Köln -> Barcelona 16.99€",
    "url": "https://www.ryanair.com/de/de/trip/flights/select?adults=1&dateOut=2026-01-26&originIata=CGN&destinationIata=BCN",
    "date": "26.01.2026"
  },
  {
    "name": "Memmingen -> Palermo 14.99€",
    "url": "https://www.ryanair.com/de/de/trip/flights/select?adults=1&dateOut=2026-01-26&originIata=FMM&destinationIata=PMO",
    "date": "26.01.2026"
  },
  {
    "name": "Memmingen -> Palma de Mallorca 19.99€",
    "url": "https://www.ryanair.com/de/de/trip/flights/select?adults=1&dateOut=2026-01-26&originIata=FMM&destinationIata=PMI",
    "date": "26.01.2026"
  },
  {
    "name": "Nürnberg -> Palermo 14.99€",
    "url": "https://www.ryanair.com/de/de/trip/flights/select?adults=1&dateOut=2026-01-26&originIata=NUE&destinationIata=PMO",
    "date": "26.01.2026"
  },
  {
    "name": "Köln -> Paphos 16.99€",
    "url": "https://www.ryanair.com/de/de/trip/flights/select?adults=1&dateOut=2026-01-27&originIata=CGN&destinationIata=PFO",
    "date": "27.01.2026"
  },
  {
    "name": "Frankfurt am Main -> Al Aaroui 14.99€",
    "url": "https://www.ryanair.com/de/de/trip/flights/select?adults=1&dateOut=2026-01-27&originIata=HHN&destinationIata=NDR",
    "date": "27.01.2026"
  },
  {
    "name": "Bremen -> Málaga 15.77€",
    "url": "https://www.ryanair.com/de/de/trip/flights/select?adults=1&dateOut=2026-01-27&originIata=BRE&destinationIata=AGP",
    "date": "27.01.2026"
  },
  {
    "name": "Karlsruhe -> Faro 16.04€",
    "url": "https://www.ryanair.com/de/de/trip/flights/select?adults=1&dateOut=2026-01-27&originIata=FKB&destinationIata=FAO",
    "date": "27.01.2026"
  },
  {
    "name": "Weeze -> Málaga 14.99€",
    "url": "https://www.ryanair.com/de/de/trip/flights/select?adults=1&dateOut=2026-01-27&originIata=NRN&destinationIata=AGP",
    "date": "27.01.2026"
  },
  {
    "name": "Lübeck -> Palma de Mallorca 14.99€",
    "url": "https://www.ryanair.com/de/de/trip/flights/select?adults=1&dateOut=2026-01-27&originIata=LBC&destinationIata=PMI",
    "date": "27.01.2026"
  },
  {
    "name": "Memmingen -> Gizzeria Lido 14.99€",
    "url": "https://www.ryanair.com/de/de/trip/flights/select?adults=1&dateOut=2026-01-27&originIata=FMM&destinationIata=SUF",
    "date": "27.01.2026"
  },
  {
    "name": "Frankfurt am Main -> Gran Canaria Island 17.39€",
    "url": "https://www.ryanair.com/de/de/trip/flights/select?adults=1&dateOut=2026-01-27&originIata=HHN&destinationIata=LPA",
    "date": "27.01.2026"
  },
  {
    "name": "Frankfurt am Main -> Málaga 14.99€",
    "url": "https://www.ryanair.com/de/de/trip/flights/select?adults=1&dateOut=2026-01-27&originIata=HHN&destinationIata=AGP",
    "date": "27.01.2026"
  },
  {
    "name": "Nürnberg -> Málaga 17.20€",
    "url": "https://www.ryanair.com/de/de/trip/flights/select?adults=1&dateOut=2026-01-27&originIata=NUE&destinationIata=AGP",
    "date": "27.01.2026"
  },
  {
    "name": "Memmingen -> Gran Canaria Island 14.99€",
    "url": "https://www.ryanair.com/de/de/trip/flights/select?adults=1&dateOut=2026-01-27&originIata=FMM&destinationIata=LPA",
    "date": "27.01.2026"
  },
  {
    "name": "Berlin -> Reggio Calabria 14.99€",
    "url": "https://www.ryanair.com/de/de/trip/flights/select?adults=1&dateOut=2026-01-28&originIata=BER&destinationIata=REG",
    "date": "28.01.2026"
  },
  {
    "name": "Weeze -> Faro 14.99€",
    "url": "https://www.ryanair.com/de/de/trip/flights/select?adults=1&dateOut=2026-01-28&originIata=NRN&destinationIata=FAO",
    "date": "28.01.2026"
  },
  {
    "name": "Karlsruhe -> Valencia 14.99€",
    "url": "https://www.ryanair.com/de/de/trip/flights/select?adults=1&dateOut=2026-01-28&originIata=FKB&destinationIata=VLC",
    "date": "28.01.2026"
  },
  {
    "name": "Weeze -> Tenerife 14.99€",
    "url": "https://www.ryanair.com/de/de/trip/flights/select?adults=1&dateOut=2026-01-28&originIata=NRN&destinationIata=TFS",
    "date": "28.01.2026"
  },
  {
    "name": "Frankfurt am Main -> Tenerife 18.28€",
    "url": "https://www.ryanair.com/de/de/trip/flights/select?adults=1&dateOut=2026-01-28&originIata=HHN&destinationIata=TFS",
    "date": "28.01.2026"
  },
  {
    "name": "Weeze -> Isola di Capo Rizzuto (KR) 14.99€",
    "url": "https://www.ryanair.com/de/de/trip/flights/select?adults=1&dateOut=2026-01-29&originIata=NRN&destinationIata=CRV",
    "date": "29.01.2026"
  },
  {
    "name": "Weeze -> Essaouira 14.99€",
    "url": "https://www.ryanair.com/de/de/trip/flights/select?adults=1&dateOut=2026-01-29&originIata=NRN&destinationIata=ESU",
    "date": "29.01.2026"
  },
  {
    "name": "Greven -> Málaga 14.99€",
    "url": "https://www.ryanair.com/de/de/trip/flights/select?adults=1&dateOut=2026-01-29&originIata=FMO&destinationIata=AGP",
    "date": "29.01.2026"
  },
  {
    "name": "Frankfurt am Main -> Agadir (Temsia) 14.99€",
    "url": "https://www.ryanair.com/de/de/trip/flights/select?adults=1&dateOut=2026-01-29&originIata=HHN&destinationIata=AGA",
    "date": "29.01.2026"
  },
  {
    "name": "Karlsruhe -> Trapani (TP) 14.99€",
    "url": "https://www.ryanair.com/de/de/trip/flights/select?adults=1&dateOut=2026-01-30&originIata=FKB&destinationIata=TPS",
    "date": "30.01.2026"
  },
  {
    "name": "Memmingen -> Gizzeria Lido 14.99€",
    "url": "https://www.ryanair.com/de/de/trip/flights/select?adults=1&dateOut=2026-01-31&originIata=FMM&destinationIata=SUF",
    "date": "31.01.2026"
  },
  {
    "name": "Karlsruhe -> Bari 14.99€",
    "url": "https://www.ryanair.com/de/de/trip/flights/select?adults=1&dateOut=2026-01-31&originIata=FKB&destinationIata=BRI",
    "date": "31.01.2026"
  },
  {
    "name": "Köln -> San Bartolom� 21.99€",
    "url": "https://www.ryanair.com/de/de/trip/flights/select?adults=1&dateOut=2026-02-01&originIata=CGN&destinationIata=ACE",
    "date": "01.02.2026"
  },
  {
    "name": "Weeze -> Palma de Mallorca 14.99€",
    "url": "https://www.ryanair.com/de/de/trip/flights/select?adults=1&dateOut=2026-02-01&originIata=NRN&destinationIata=PMI",
    "date": "01.02.2026"
  },
  {
    "name": "Köln -> Palma de Mallorca 15.99€",
    "url": "https://www.ryanair.com/de/de/trip/flights/select?adults=1&dateOut=2026-02-02&originIata=CGN&destinationIata=PMI",
    "date": "02.02.2026"
  },
  {
    "name": "Weeze -> Palma de Mallorca 14.99€",
    "url": "https://www.ryanair.com/de/de/trip/flights/select?adults=1&dateOut=2026-02-02&originIata=NRN&destinationIata=PMI",
    "date": "02.02.2026"
  },
  {
    "name": "Memmingen -> Palermo 14.99€",
    "url": "https://www.ryanair.com/de/de/trip/flights/select?adults=1&dateOut=2026-02-02&originIata=FMM&destinationIata=PMO",
    "date": "02.02.2026"
  },
  {
    "name": "Frankfurt am Main -> Gizzeria Lido 14.99€",
    "url": "https://www.ryanair.com/de/de/trip/flights/select?adults=1&dateOut=2026-02-02&originIata=HHN&destinationIata=SUF",
    "date": "02.02.2026"
  },
  {
    "name": "Karlsruhe -> Málaga 14.99€",
    "url": "https://www.ryanair.com/de/de/trip/flights/select?adults=1&dateOut=2026-02-02&originIata=FKB&destinationIata=AGP",
    "date": "02.02.2026"
  },
  {
    "name": "Paderborn -> Alicante 14.99€",
    "url": "https://www.ryanair.com/de/de/trip/flights/select?adults=1&dateOut=2026-02-02&originIata=PAD&destinationIata=ALC",
    "date": "02.02.2026"
  },
  {
    "name": "Weeze -> Bari 14.99€",
    "url": "https://www.ryanair.com/de/de/trip/flights/select?adults=1&dateOut=2026-02-03&originIata=NRN&destinationIata=BRI",
    "date": "03.02.2026"
  },
  {
    "name": "Nürnberg -> Bari 14.99€",
    "url": "https://www.ryanair.com/de/de/trip/flights/select?adults=1&dateOut=2026-02-05&originIata=NUE&destinationIata=BRI",
    "date": "05.02.2026"
  },
  {
    "name": "Frankfurt am Main -> Gizzeria Lido 14.99€",
    "url": "https://www.ryanair.com/de/de/trip/flights/select?adults=1&dateOut=2026-02-05&originIata=HHN&destinationIata=SUF",
    "date": "05.02.2026"
  },
  {
    "name": "Nürnberg -> Palma de Mallorca 14.99€",
    "url": "https://www.ryanair.com/de/de/trip/flights/select?adults=1&dateOut=2026-02-07&originIata=NUE&destinationIata=PMI",
    "date": "07.02.2026"
  },
  {
    "name": "Frankfurt am Main -> Palma de Mallorca 14.99€",
    "url": "https://www.ryanair.com/de/de/trip/flights/select?adults=1&dateOut=2026-02-09&originIata=HHN&destinationIata=PMI",
    "date": "09.02.2026"
  },
  {
    "name": "Weeze -> Bari 14.99€",
    "url": "https://www.ryanair.com/de/de/trip/flights/select?adults=1&dateOut=2026-02-09&originIata=NRN&destinationIata=BRI",
    "date": "09.02.2026"
  },
  {
    "name": "Weeze -> Alicante 14.99€",
    "url": "https://www.ryanair.com/de/de/trip/flights/select?adults=1&dateOut=2026-02-09&originIata=NRN&destinationIata=ALC",
    "date": "09.02.2026"
  },
  {
    "name": "Hamburg -> Palma de Mallorca 14.99€",
    "url": "https://www.ryanair.com/de/de/trip/flights/select?adults=1&dateOut=2026-02-14&originIata=HAM&destinationIata=PMI",
    "date": "14.02.2026"
  },
  {
    "name": "Frankfurt am Main -> Al Aaroui 14.99€",
    "url": "https://www.ryanair.com/de/de/trip/flights/select?adults=1&dateOut=2026-02-21&originIata=HHN&destinationIata=NDR",
    "date": "21.02.2026"
  },
  {
    "name": "Frankfurt am Main -> Alicante 14.99€",
    "url": "https://www.ryanair.com/de/de/trip/flights/select?adults=1&dateOut=2026-02-25&originIata=HHN&destinationIata=ALC",
    "date": "25.02.2026"
  }
]